qcu/.cache/tunecache_error.tsv
tunecache	1.1.0	1.1.0--sm_70	cpu_arch=x86_64,gpu_arch=sm_70,cuda_version=11.6.124	# Last updated Thu Aug 17 23:24:54 2023

          volume	name	aux	block.x	block.y	block.z	grid.x	grid.y	grid.z	shared_bytes	aux.x	aux.y	aux.z	aux.w	time	comment
     16x16x16x32	N4quda10GaugeGaussIdLi3EL21QudaReconstructType_s12EEE	GPU-offline,vol=131072stride=69632precision=8geometry=4Nc=3,lie_group	64	2	1	1024	1	1	0	-1	-1	-1	-1	0.000333429	# 0.00 Gflop/s, 160.39 GB/s, tuning took 0.520485 seconds at Tue Aug  8 20:13:17 2023
     16x16x16x32	N4quda12ExtractGhostIdLi3ENS_5gauge11FloatNOrderIdLi18ELi2ELi12EL20QudaStaggeredPhase_s0ELb1EL19QudaGhostExchange_sn2147483648ELb0EEEEE	GPU-offline,vol=131072stride=69632precision=8geometry=4Nc=3,extract	64	1	3	128	1	3	0	-1	-1	-1	-1	1.37671e-05	# 0.00 Gflop/s, 399.87 GB/s, tuning took 0.096189 seconds at Tue Aug  8 20:13:15 2023
     16x16x16x32	N4quda7RNGInitE	GPU-offline,vol=131072stride=69632precision=8geometry=4Nc=3	320	2	1	205	1	1	0	-1	-1	-1	-1	0.00194762	# 0.00 Gflop/s, 0.00 GB/s, tuning took 0.386414 seconds at Tue Aug  8 20:13:16 2023
     16x16x16x32	N4quda9CopyGaugeINS_12CopyGaugeArgIddLi18ELb0ENS_5gauge11FloatNOrderIdLi18ELi2ELi12EL20QudaStaggeredPhase_s0ELb1EL19QudaGhostExchange_sn2147483648ELb0EEENS2_8QDPOrderIdLi18EEEEEEE	GPU-offline,cmem,vol=131072stride=65536precision=8geometry=4Nc=3,vol=131072stride=69632precision=8geometry=4Nc=3	96	1	1	683	1	8	2341	-1	-1	-1	-1	0.000156443	# 0.00 Gflop/s, 824.42 GB/s, tuning took 0.443535 seconds at Tue Aug  8 20:13:15 2023
     16x16x16x32	N4quda9CopyGaugeINS_12CopyGaugeArgIddLi18ELb0ENS_5gauge8QDPOrderIdLi18EEENS2_11FloatNOrderIdLi18ELi2ELi12EL20QudaStaggeredPhase_s0ELb1EL19QudaGhostExchange_sn2147483648ELb0EEEEEEE	GPU-offline,cmem,vol=131072stride=69632precision=8geometry=4Nc=3,vol=131072stride=65536precision=8geometry=4Nc=3	96	1	1	683	1	8	2458	-1	-1	-1	-1	0.000163278	# 0.00 Gflop/s, 789.91 GB/s, tuning took 0.451958 seconds at Tue Aug  8 20:13:17 2023
     16x16x16x32	N4quda9CopyGaugeINS_12CopyGaugeArgIfdLi18ELb0ENS_5gauge11FloatNOrderIfLi18ELi4ELi12EL20QudaStaggeredPhase_s0ELb1EL19QudaGhostExchange_sn2147483648ELb0EEENS3_IdLi18ELi2ELi12ELS4_0ELb1ELS5_n2147483648ELb0EEEEEEE	GPU-offline,cmem,vol=131072stride=69632precision=8geometry=4Nc=3,vol=131072stride=69632precision=4geometry=4Nc=3	32	1	1	2048	1	8	0	-1	-1	-1	-1	9.60902e-05	# 0.00 Gflop/s, 834.80 GB/s, tuning took 0.280706 seconds at Tue Aug  8 20:13:16 2023
     16x16x16x32	N4quda9CopyGaugeINS_12CopyGaugeArgIsdLi18ELb0ENS_5gauge11FloatNOrderIsLi18ELi4ELi12EL20QudaStaggeredPhase_s0ELb1EL19QudaGhostExchange_sn2147483648ELb0EEENS3_IdLi18ELi2ELi12ELS4_0ELb1ELS5_n2147483648ELb0EEEEEEE	GPU-offline,cmem,vol=131072stride=69632precision=8geometry=4Nc=3,vol=131072stride=69632precision=2geometry=4Nc=3	128	1	1	512	1	8	3781	-1	-1	-1	-1	8.5808e-05	# 0.00 Gflop/s, 779.03 GB/s, tuning took 0.298789 seconds at Tue Aug  8 20:13:16 2023
     16x32x32x64	N4quda15CopyColorSpinorILi4ELi3ENS_11colorspinor11FloatNOrderIdLi4ELi3ELi2ELb0ELb0EEENS1_21SpaceSpinorColorOrderIdLi4ELi3EEESt5tupleIJRNS_16ColorSpinorFieldERKS7_19QudaFieldLocation_sPdPKdEEEE	GPU-offline,cmem,vol=1048576,parity=1,precision=8,order=9,Ns=4,Nc=3vol=1048576,parity=1,precision=8,order=2,Ns=4,Nc=3,NonRelBasis	32	1	1	32768	1	1	0	-1	-1	-1	-1	0.000496235	# 0.00 Gflop/s, 811.42 GB/s, tuning took 0.078503 seconds at Mon Aug  7 20:10:28 2023
     16x32x32x64	N4quda15CopyColorSpinorILi4ELi3ENS_11colorspinor21SpaceSpinorColorOrderIdLi4ELi3EEENS1_11FloatNOrderIdLi4ELi3ELi2ELb0ELb0EEESt5tupleIJRNS_16ColorSpinorFieldERKS7_19QudaFieldLocation_sPdPKdEEEE	GPU-offline,cmem,vol=1048576,parity=1,precision=8,order=2,Ns=4,Nc=3vol=1048576,parity=1,precision=8,order=9,Ns=4,Nc=3,RelBasis	128	1	1	8192	1	1	0	-1	-1	-1	-1	0.000492011	# 0.00 Gflop/s, 818.38 GB/s, tuning took 0.058021 seconds at Mon Aug  7 20:10:30 2023
     16x32x32x64	N4quda26WilsonCloverPreconditionedINS_15WilsonCloverArgIdLi3ELi4EL21QudaReconstructType_s12EEEEE	policy,GPU-offline,vol=1048576,parity=1,precision=8,order=2,Ns=4,Nc=3,commDim=0000,topo=1111,p2p=0,gdr=0,nvshmem=0,pol=110000111100110000	32	1	1	1	1	1	0	8	0	0	-1	0.00268731	# 711.72 Gflop/s, 1123.76 GB/s, tuning took 0.151199 seconds at Thu Aug 10 17:23:54 2023
     16x32x32x64	N4quda26WilsonCloverPreconditionedINS_15WilsonCloverArgIdLi3ELi4EL21QudaReconstructType_s12EEEEE	policy_kernel=single,GPU-offline,vol=1048576,parity=1,precision=8,order=2,Ns=4,Nc=3,commDim=0000,comm=0000	128	1	1	8192	1	1	49153	-1	-1	-1	-1	0.00268978	# 711.06 Gflop/s, 1122.73 GB/s, tuning took 3.217566 seconds at Thu Aug 10 17:23:54 2023
     16x32x32x64	N4quda6WilsonINS_9WilsonArgIdLi3ELi4EL21QudaReconstructType_s12EEEEE	policy,GPU-offline,vol=1048576,parity=1,precision=8,order=2,Ns=4,Nc=3,commDim=0000,topo=1111,p2p=0,gdr=0,nvshmem=0,pol=110000111100110000	32	1	1	1	1	1	0	6	0	0	-1	0.00194555	# 711.43 Gflop/s, 1241.77 GB/s, tuning took 0.109958 seconds at Mon Aug  7 20:10:30 2023
     16x32x32x64	N4quda6WilsonINS_9WilsonArgIdLi3ELi4EL21QudaReconstructType_s12EEEEE	policy_kernel=single,GPU-offline,vol=1048576,parity=1,precision=8,order=2,Ns=4,Nc=3,commDim=0000,comm=0000	128	1	1	8192	1	1	49153	-1	-1	-1	-1	0.001947	# 710.90 Gflop/s, 1240.84 GB/s, tuning took 2.393836 seconds at Mon Aug  7 20:10:30 2023
     32x32x32x64	N4quda10CopyCloverINS_6clover11FloatNOrderIfLi72ELi4ELb0ELb0ELb0EEENS2_IdLi72ELi2ELb0ELb0ELb0EEEfdEE	GPU-offline,cmem,vol=2097152precision=8Nc=3	32	2	1	32768	1	1	1537	-1	-1	-1	-1	0.00213143	# 0.00 Gflop/s, 850.10 GB/s, tuning took 1.820336 seconds at Thu Aug 10 17:23:48 2023
     32x32x32x64	N4quda10CopyCloverINS_6clover11FloatNOrderIsLi72ELi8ELb0ELb0ELb0EEENS2_IdLi72ELi2ELb0ELb0ELb0EEEsdEE	GPU-offline,cmem,vol=2097152precision=8Nc=3	64	1	1	16384	2	1	0	-1	-1	-1	-1	0.00185233	# 0.00 Gflop/s, 815.16 GB/s, tuning took 1.590299 seconds at Thu Aug 10 17:23:46 2023
     32x32x32x64	N4quda10GaugeGaussIdLi3EL21QudaReconstructType_s12EEE	GPU-offline,vol=2097152stride=1081344precision=8geometry=4Nc=3,lie_group	384	1	1	2731	2	1	16385	-1	-1	-1	-1	0.0046939	# 0.00 Gflop/s, 176.93 GB/s, tuning took 6.210466 seconds at Mon Aug  7 17:49:51 2023
     32x32x32x64	N4quda11CopyGaugeExIddLi18ENS_5gauge11FloatNOrderIdLi18ELi2ELi18EL20QudaStaggeredPhase_s0ELb1EL19QudaGhostExchange_sn2147483648ELb0EEENS2_IdLi18ELi2ELi12ELS3_0ELb1ELS4_n2147483648ELb0EEEEE	GPU-offline,cmem,vol=2097152stride=1081344precision=8geometry=4Nc=3vol=2097152stride=1048576precision=8geometry=4Nc=3r=0000	32	2	1	32768	1	1	2235	-1	-1	-1	-1	0.00254611	# 0.00 Gflop/s, 800.61 GB/s, tuning took 2.622500 seconds at Thu Aug 10 17:23:51 2023
     32x32x32x64	N4quda11CopyGaugeExIddLi18ENS_5gauge11FloatNOrderIdLi18ELi2ELi18EL20QudaStaggeredPhase_s0ELb1EL19QudaGhostExchange_sn2147483648ELb0EEES5_EE	GPU-offline,cmem,vol=2097152stride=1081344precision=8geometry=4Nc=3vol=2097152stride=1048576precision=8geometry=4Nc=3r=0000	96	1	1	10923	2	1	2458	-1	-1	-1	-1	0.00295482	# 0.00 Gflop/s, 830.40 GB/s, tuning took 3.018751 seconds at Thu Aug 10 17:22:22 2023
     32x32x32x64	N4quda12CloverInvertIdEE	GPU-offline,vol=2097152precision=8Nc=3,trlog=true,twist=false	64	2	1	160	1	1	3511	-1	-1	-1	-1	0.00310476	# 0.00 Gflop/s, 778.13 GB/s, tuning took 46.658526 seconds at Thu Aug 10 17:23:40 2023
     32x32x32x64	N4quda12ExtractGhostIdLi3ENS_5gauge11FloatNOrderIdLi18ELi2ELi12EL20QudaStaggeredPhase_s0ELb1EL19QudaGhostExchange_sn2147483648ELb0EEEEE	GPU-offline,vol=2097152stride=1081344precision=8geometry=4Nc=3,extract	32	1	3	2048	1	3	0	-1	-1	-1	-1	7.94658e-05	# 0.00 Gflop/s, 554.20 GB/s, tuning took 0.161376 seconds at Mon Aug  7 17:49:36 2023
     32x32x32x64	N4quda12ExtractGhostIdLi3ENS_5gauge11FloatNOrderIdLi18ELi2ELi18EL20QudaStaggeredPhase_s0ELb1EL19QudaGhostExchange_sn2147483648ELb0EEEEE	GPU-offline,vol=2097152stride=1081344precision=8geometry=4Nc=3,extract	32	1	7	2048	1	2	0	-1	-1	-1	-1	0.000119072	# 0.00 Gflop/s, 554.79 GB/s, tuning took 0.218231 seconds at Thu Aug 10 17:22:14 2023
     32x32x32x64	N4quda13ComputeCloverIdEE	GPU-offline,vol=2097152precision=8Nc=3	160	1	1	6554	2	1	0	-1	-1	-1	-1	0.00339649	# 296.37 Gflop/s, 889.12 GB/s, tuning took 0.275285 seconds at Thu Aug 10 17:22:53 2023
     32x32x32x64	N4quda5FmunuIdLi3EL21QudaReconstructType_s18EEE	GPU-offline,vol=2097152stride=1048576precision=8geometry=4Nc=3r=0000,comm=0000	32	2	4	32768	1	2	0	-1	-1	-1	-1	0.0149231	# 2079.30 Gflop/s, 2064.12 GB/s, tuning took 31.400793 seconds at Thu Aug 10 17:22:53 2023
     32x32x32x64	N4quda7RNGInitE	GPU-offline,vol=2097152stride=1081344precision=8geometry=4Nc=3	320	2	1	3277	1	1	0	-1	-1	-1	-1	0.0305155	# 0.00 Gflop/s, 0.00 GB/s, tuning took 4.549793 seconds at Mon Aug  7 17:49:45 2023
     32x32x32x64	N4quda9CopyGaugeINS_12CopyGaugeArgIddLi18ELb0ENS_5gauge11FloatNOrderIdLi18ELi2ELi12EL20QudaStaggeredPhase_s0ELb1EL19QudaGhostExchange_sn2147483648ELb0EEENS2_8QDPOrderIdLi18EEEEEEE	GPU-offline,cmem,vol=2097152stride=1048576precision=8geometry=4Nc=3,vol=2097152stride=1081344precision=8geometry=4Nc=3	64	1	1	16384	1	8	0	-1	-1	-1	-1	0.00240693	# 0.00 Gflop/s, 846.90 GB/s, tuning took 3.933552 seconds at Mon Aug  7 17:49:35 2023
     32x32x32x64	N4quda9CopyGaugeINS_12CopyGaugeArgIddLi18ELb0ENS_5gauge11FloatNOrderIdLi18ELi2ELi18EL20QudaStaggeredPhase_s0ELb1EL19QudaGhostExchange_sn2147483648ELb0EEENS2_8QDPOrderIdLi18EEEEEEE	GPU-offline,cmem,vol=2097152stride=1048576precision=8geometry=4Nc=3,vol=2097152stride=1081344precision=8geometry=4Nc=3	992	1	1	1058	1	8	24577	-1	-1	-1	-1	0.00294745	# 0.00 Gflop/s, 832.47 GB/s, tuning took 4.775428 seconds at Thu Aug 10 17:22:14 2023
     32x32x32x64	N4quda9CopyGaugeINS_12CopyGaugeArgIddLi18ELb0ENS_5gauge8QDPOrderIdLi18EEENS2_11FloatNOrderIdLi18ELi2ELi12EL20QudaStaggeredPhase_s0ELb1EL19QudaGhostExchange_sn2147483648ELb0EEEEEEE	GPU-offline,cmem,vol=2097152stride=1081344precision=8geometry=4Nc=3,vol=2097152stride=1048576precision=8geometry=4Nc=3	96	1	1	10923	1	8	0	-1	-1	-1	-1	0.00252437	# 0.00 Gflop/s, 807.50 GB/s, tuning took 4.134688 seconds at Mon Aug  7 17:49:55 2023
     32x32x32x64	N4quda9CopyGaugeINS_12CopyGaugeArgIfdLi18ELb0ENS_5gauge11FloatNOrderIfLi18ELi4ELi12EL20QudaStaggeredPhase_s0ELb1EL19QudaGhostExchange_sn2147483648ELb0EEENS3_IdLi18ELi2ELi12ELS4_0ELb1ELS5_n2147483648ELb0EEEEEEE	GPU-offline,cmem,vol=2097152stride=1081344precision=8geometry=4Nc=3,vol=2097152stride=1081344precision=4geometry=4Nc=3	32	1	1	32768	1	8	0	-1	-1	-1	-1	0.00142235	# 0.00 Gflop/s, 875.81 GB/s, tuning took 2.427331 seconds at Mon Aug  7 17:49:40 2023
     32x32x32x64	N4quda9CopyGaugeINS_12CopyGaugeArgIfdLi18ELb0ENS_5gauge11FloatNOrderIfLi18ELi4ELi12EL20QudaStaggeredPhase_s0ELb1EL19QudaGhostExchange_sn2147483648ELb0EEENS3_IdLi18ELi2ELi18ELS4_0ELb1ELS5_n2147483648ELb0EEEEEEE	GPU-offline,cmem,vol=2097152stride=1081344precision=8geometry=4Nc=3,vol=2097152stride=1081344precision=4geometry=4Nc=3	32	1	1	32768	1	8	0	-1	-1	-1	-1	0.00142213	# 0.00 Gflop/s, 1167.92 GB/s, tuning took 2.417724 seconds at Thu Aug 10 17:22:19 2023
     32x32x32x64	N4quda9CopyGaugeINS_12CopyGaugeArgIsdLi18ELb0ENS_5gauge11FloatNOrderIsLi18ELi4ELi12EL20QudaStaggeredPhase_s0ELb1EL19QudaGhostExchange_sn2147483648ELb0EEENS3_IdLi18ELi2ELi12ELS4_0ELb1ELS5_n2147483648ELb0EEEEEEE	GPU-offline,cmem,vol=2097152stride=1081344precision=8geometry=4Nc=3,vol=2097152stride=1081344precision=2geometry=4Nc=3	96	1	1	10923	1	8	0	-1	-1	-1	-1	0.00122185	# 0.00 Gflop/s, 849.61 GB/s, tuning took 2.105499 seconds at Mon Aug  7 17:49:38 2023
     32x32x32x64	N4quda9CopyGaugeINS_12CopyGaugeArgIsdLi18ELb0ENS_5gauge11FloatNOrderIsLi18ELi4ELi12EL20QudaStaggeredPhase_s0ELb1EL19QudaGhostExchange_sn2147483648ELb0EEENS3_IdLi18ELi2ELi18ELS4_0ELb1ELS5_n2147483648ELb0EEEEEEE	GPU-offline,cmem,vol=2097152stride=1081344precision=8geometry=4Nc=3,vol=2097152stride=1081344precision=2geometry=4Nc=3	96	1	1	10923	1	8	0	-1	-1	-1	-1	0.00122217	# 0.00 Gflop/s, 1189.14 GB/s, tuning took 2.105199 seconds at Thu Aug 10 17:22:16 2023
        75497472	N4quda15TransformReduceINS_7maximumIdEEKNS_7complexIdEEmNS_8abs_max_IddEENS_8identityEEE	,batch_size=1	1024	1	1	160	1	1	0	-1	-1	-1	-1	0.00136372	# 0.00 Gflop/s, 885.78 GB/s, tuning took 4.476428 seconds at Thu Aug 10 17:23:44 2023
      8x16x16x32	N4quda15CopyColorSpinorILi4ELi3ENS_11colorspinor11FloatNOrderIdLi4ELi3ELi2ELb0ELb0EEENS1_21SpaceSpinorColorOrderIdLi4ELi3EEESt5tupleIJRNS_16ColorSpinorFieldERKS7_19QudaFieldLocation_sPdPKdEEEE	GPU-offline,cmem,vol=65536,parity=1,precision=8,order=9,Ns=4,Nc=3vol=65536,parity=1,precision=8,order=2,Ns=4,Nc=3,NonRelBasis	416	1	1	158	1	1	0	-1	-1	-1	-1	3.49109e-05	# 0.00 Gflop/s, 720.86 GB/s, tuning took 0.014482 seconds at Tue Aug  8 20:13:18 2023
      8x16x16x32	N4quda15CopyColorSpinorILi4ELi3ENS_11colorspinor21SpaceSpinorColorOrderIdLi4ELi3EEENS1_11FloatNOrderIdLi4ELi3ELi2ELb0ELb0EEESt5tupleIJRNS_16ColorSpinorFieldERKS7_19QudaFieldLocation_sPdPKdEEEE	GPU-offline,cmem,vol=65536,parity=1,precision=8,order=2,Ns=4,Nc=3vol=65536,parity=1,precision=8,order=9,Ns=4,Nc=3,RelBasis	32	1	1	2048	1	1	0	-1	-1	-1	-1	3.54423e-05	# 0.00 Gflop/s, 710.05 GB/s, tuning took 0.014264 seconds at Tue Aug  8 20:13:18 2023
      8x16x16x32	N4quda6WilsonINS_9WilsonArgIdLi3ELi4EL21QudaReconstructType_s12EEEEE	policy,GPU-offline,vol=65536,parity=1,precision=8,order=2,Ns=4,Nc=3,commDim=0000,topo=1111,p2p=0,gdr=0,nvshmem=0,pol=110000111100110000	32	1	1	1	1	1	0	7	0	0	-1	0.000128436	# 673.55 Gflop/s, 1175.64 GB/s, tuning took 0.013251 seconds at Tue Aug  8 20:13:18 2023
      8x16x16x32	N4quda6WilsonINS_9WilsonArgIdLi3ELi4EL21QudaReconstructType_s12EEEEE	policy_kernel=single,GPU-offline,vol=65536,parity=1,precision=8,order=2,Ns=4,Nc=3,commDim=0000,comm=0000	32	1	1	2048	1	1	16385	-1	-1	-1	-1	0.000129244	# 669.33 Gflop/s, 1168.29 GB/s, tuning took 0.178063 seconds at Tue Aug  8 20:13:18 2023
  bytes=18874368	cudaMemcpyDefault	copy,cuda_gauge_field.cpp,576	32	1	1	1	1	1	0	-1	-1	-1	-1	5.46667e-05	# 0.00 Gflop/s, 345.26 GB/s, tuning took 0.002070 seconds at Tue Aug  8 20:13:15 2023
  bytes=18874368	cudaMemcpyDefault	saveCPUField,cuda_gauge_field.cpp,658	32	1	1	1	1	1	0	-1	-1	-1	-1	5.45246e-05	# 0.00 Gflop/s, 346.16 GB/s, tuning took 0.001896 seconds at Tue Aug  8 20:13:17 2023
  bytes=22020096	cudaMemset	allocateGhostBuffer,lattice_field.cpp,288	32	1	1	1	1	1	0	-1	-1	-1	-1	2.95069e-05	# 0.00 Gflop/s, 746.27 GB/s, tuning took 0.003124 seconds at Mon Aug  7 17:49:35 2023
  bytes=22020096	cudaMemset	allocateGhostBuffer,lattice_field.cpp,293	32	1	1	1	1	1	0	-1	-1	-1	-1	2.9634e-05	# 0.00 Gflop/s, 743.07 GB/s, tuning took 0.001119 seconds at Mon Aug  7 17:49:35 2023
   bytes=2752512	cudaMemset	allocateGhostBuffer,lattice_field.cpp,288	32	1	1	1	1	1	0	-1	-1	-1	-1	4.412e-06	# 0.00 Gflop/s, 623.87 GB/s, tuning took 0.003095 seconds at Tue Aug  8 20:13:15 2023
   bytes=2752512	cudaMemset	allocateGhostBuffer,lattice_field.cpp,293	32	1	1	1	1	1	0	-1	-1	-1	-1	4.33715e-06	# 0.00 Gflop/s, 634.64 GB/s, tuning took 0.000977 seconds at Tue Aug  8 20:13:15 2023
 bytes=301989888	cudaMemcpyDefault	copy,cuda_gauge_field.cpp,576	32	1	1	1	1	1	0	-1	-1	-1	-1	0.000770731	# 0.00 Gflop/s, 391.82 GB/s, tuning took 0.005783 seconds at Mon Aug  7 17:49:31 2023
 bytes=301989888	cudaMemcpyDefault	saveCPUField,cuda_gauge_field.cpp,658	32	1	1	1	1	1	0	-1	-1	-1	-1	0.000771712	# 0.00 Gflop/s, 391.32 GB/s, tuning took 0.007972 seconds at Mon Aug  7 17:49:55 2023
   bytes=3145728	cudaMemcpyDeviceToDevice	exchangeGhost,cuda_gauge_field.cpp,193	32	1	1	1	1	1	0	-1	-1	-1	-1	5.79802e-06	# 0.00 Gflop/s, 1085.10 GB/s, tuning took 0.000710 seconds at Mon Aug  7 17:49:36 2023
  bytes=33030144	cudaMemset	allocateGhostBuffer,lattice_field.cpp,288	32	1	1	1	1	1	0	-1	-1	-1	-1	4.2052e-05	# 0.00 Gflop/s, 785.46 GB/s, tuning took 0.001250 seconds at Thu Aug 10 17:22:14 2023
  bytes=33030144	cudaMemset	allocateGhostBuffer,lattice_field.cpp,293	32	1	1	1	1	1	0	-1	-1	-1	-1	4.26747e-05	# 0.00 Gflop/s, 774.00 GB/s, tuning took 0.001245 seconds at Thu Aug 10 17:22:14 2023
    bytes=393216	cudaMemcpyDeviceToDevice	exchangeGhost,cuda_gauge_field.cpp,193	32	1	1	1	1	1	0	-1	-1	-1	-1	4.47981e-06	# 0.00 Gflop/s, 175.55 GB/s, tuning took 0.003318 seconds at Tue Aug  8 20:13:15 2023
   bytes=4718592	cudaMemcpyDeviceToDevice	exchangeGhost,cuda_gauge_field.cpp,193	32	1	1	1	1	1	0	-1	-1	-1	-1	1.69855e-05	# 0.00 Gflop/s, 555.60 GB/s, tuning took 0.001088 seconds at Thu Aug 10 17:22:14 2023
   bytes=6291456	cudaMemcpyDeviceToDevice	exchangeGhost,cuda_gauge_field.cpp,193	32	1	1	1	1	1	0	-1	-1	-1	-1	2.15985e-05	# 0.00 Gflop/s, 582.58 GB/s, tuning took 0.001080 seconds at Mon Aug  7 17:49:36 2023
    bytes=786432	cudaMemcpyDeviceToDevice	exchangeGhost,cuda_gauge_field.cpp,193	32	1	1	1	1	1	0	-1	-1	-1	-1	3.15623e-06	# 0.00 Gflop/s, 498.34 GB/s, tuning took 0.000864 seconds at Tue Aug  8 20:13:15 2023
   bytes=9437184	cudaMemcpyDeviceToDevice	exchangeGhost,cuda_gauge_field.cpp,193	32	1	1	1	1	1	0	-1	-1	-1	-1	2.9878e-05	# 0.00 Gflop/s, 631.71 GB/s, tuning took 0.001139 seconds at Thu Aug 10 17:22:14 2023
